Year,Month,Day,Letter,To,From,Mention Type,Sent.,About
49,3,25,Att. 9.15,Atticus,Cicero,Mention,0,"Cicero is again lamenting that he isn't there with Pompey as he takes flight. However, he seems eager to meet with Caesar and content that he is safe at home."
49,3,23,Att. 9.15A,Cicero,Matius and Trebatius,Mention,0,"Pompey left Brundisium, Caesar is heading for Rome."
49,3,29,Att. 9.18,Atticus,Cicero,Mention,0,"Cicero met with Caesar. Stood up to him: said that if he spoke in the senate, he would urge no more military action (against Caesar's plans). Caesar urged him to think it over, but Cicero thinks he isn't stricty happy. Cicero is wondering what to do next."
49,4,1,Att. 9.19,Atticus,Cicero,Mention,-1,"Caesar is levying troops in Italy. Cicero has made up his mind to go to Pompey and leave everything behind. Not for the sake of the republic, but so that Cicero doesn't look ungrateful to Pompey for bringing him out of exile (even though he helped put him in exile). "
49,4,3,Att. 10.1,Atticus,Cicero,Mention,0,"Cicero is on his way to Greece, presumably to join Pompey."
49,4,7,Att. 10.3,Atticus,Cicero,Mention,0,"Cicero wants to know who Caesar is putting in charge of various regions, who was sent to Pompey for peace, and what state Caesar is leaving Rome in."
49,4,7,Att. 10.3A,Atticus,Cicero,Mention,0,Caesar forgives Cicero for not appearing. 
49,4,14,Att. 10.4,Atticus,Cicero,Mention,-1,"Cicero is angry at Caesar for going so aggressively after Pompey, but is angry at Pompey for waging war against his contryment and country. Trashing both men. Neither are as accomplished as Cicero."
49,4,26,Att. 10.6,Atticus,Cicero,Mention,0,"Pompey is going from Illyricum into Gaul. Cicero unsure of what route he, himself, should take."
49,4,27,Att. 10.7,Atticus,Cicero,Mention,,No saving the constituion. Contest of rival kings. Cicero is leaving Italy. Doesn't wish to be ungrateful to Pompey.
49,4,30,Att. 10.8a,Cicero,M. Antonius,Reference,-1,"Antony is shocked that Cicero is leaving, and asks him to reconsider. Mentions how Pompey helped send him into exile. Assures him that Caesar does not feel unaffectionatly towards him and that regardless, Caesar will let him be safe."
49,5,,Fam. 2.16,M. Caelius Rufus,Cicero,Mention,0,"Cicero catches up with Caelius. Asks him to do his best to protect his family while he may be abroad with Pompey. Attempts to explain why he is leaving Italy now, when he had thought it so detestable earlier."
49,5,2,Att. 10.8,Atticus,Cicero,Mention,0,Cicero will cease correspondance about things that are sensitive if it were intercepted. Hopes Caesar is driven from Spain. Probably wouldn't support Pompey if he lost Spain.
49,5,3,Att. 10.9,Atticus,Cicero,Mention,-1,"Cicero is going to Malta and seems that he will abstain from the fighting (Caesar approves). Cicero wishes to meet up with Pompey, but must consider his and his family's safety (? Does he really want to?)"
49,5,3,Att. 10.10,Atticus,Cicero,Mention,1,"Caesar says leaving Italy is taking a side (from Antony), but Cicero still intends to leave. That's a point for Pompey."
49,5,8,Att. 10.14,Atticus,Cicero,Mention,0,Servius is out of favor with all sides. Whoever wins the war will need to take money from private citizens. Potentially good news from Spain.
,,,,,,,,
48,2,,Fam. 8.17,Cicero,M. Caelius Rufus,Mention,1,"Somewhat antagonistic letter from Caelius, who appears angry that Cicero left to support Pompey."
48,5,,Fam. 9.9,Cicero,Dolabella,Mention,-1,"Caesar has the advantage. Dolabella wishes Cicero would either withdraw or come to Caesar's side, for Cicero's own good. Says Cicero has paid debts to Pompey."
48,6,,Att. 11.4a,Atticus,Cicero,Mention,1,Cicero is going to Pompey. Can't say a lot in a letter.
48,11,27,Att. 11.6,Atticus,Cicero,Mention,1,"Pompey was honest, pure, and a man of principle. But, his downfall in this manner was innevitable. People were not confident of his success. Cicero is now figuring out how to get back to Rome and in Caesar's favor."
48,12,17,Att. 11.7,Atticus,Cicero,Mention,-1,"Only those who Caesar approves (on a case-by-case basis) can come back to Italy. People say Cicero should go to Africa, where Pompey's people gather. Cicero does not wish to do so, for he doesn't see it as right."